;agency_words;agency;climate_words;climate;covid_words;covid;health_words;health;possibility_words;possibility;social_words;social;urgency_words;urgency
week_2;disobedience, confront, proud_endorse;3;earth_day, big_oil, environmental_racism, fossil, oil_company, natural_gas, new_deal, air_water, justtransition, exxonmobil, deforestation, warming, bluenewdeal, planetary, grandchild, irreversible, environmentaljustice, atmosphere, grandkid, offshore, chemical, firstenergy, electrify, indigenou, sunrisebgky, greennewdealva, sssunrise, greener, blkbigproblem, hotter, melting, sunrisemvntboston, gretathunberg, environman, climatedenier, carcinogenic, boiseclimatestrike, ecosocialist, whyigotalumpofcoal, climatestr;40;distanc;1;medicare_all, healthy, medicareforall, homelessness, cancer, asthma, medically, vaccinate;8;impactful;1;moratorium, homeless, poverty, houseless, affordablehouse;5;unbelievable, genocide, unprecedented;3
week_3;sign_petition, signtheejbill, reclaimourpower;3;wildlife, dioxide, sunrisefranklin, vegan, billionforclimate, australianfire, bio, greenwash, frack, pgeiskillingus, allwewantforchristmasisagreennewdeal, hgsustrike, savecongorainforest, envirnmental, taxtherichforagreennewdeal, alliwantforchristmasisagreennewdeal, greennewdealforxmas, savethetree, ispeakforthetree, nomoretoxicschool, greennewdealforchristmas, chesapeakeclimate;22;0;0;hospital, medicine;2;0;0;homesguarantee, unionized, unionsforall;3;endanger, apocalypse, importantly, nightmare;4
week_4;0;0;greenwashe, consumption, underwater, hazardous, smarterthanafossilfuel, environmentaljusticebill, nomorefossilfuelmoney, polluting, leakage;9;0;0;0;0;0;0;0;0;violation, fierce, battleground;3
week_5;awaken;1;gas_company, decadeofthegreennewdeal, bushfire, australiafire, sunrisechico, climateart, penguin, iceberg, aluminium, australiaburne, unbreathable, climateemegency, energytwitter, australianfi, australiabushfire;15;0;0;0;0;0;0;0;0;vulnerable, murderous, horrific, massively, extermination;5
week_6;vote_resoundingly, demonstrate, fundraise, africanactivist;4;ecological, pipe, insulin, unsustainable, earthquake, climatecatastrophe, aboriginal, billionforclimateny, australianbushfire, countdowntoshutdown, australi, ecologic, greene, environm, nomorefossilfuels;15;stay_home, immune;2;insurance, health_insurance, healthcare_system, uninsure, universalhealthcare;5;0;0;mortgage, student_loan, housingjustice;3;disgrace, tragedy, violently, atrocity;4
week_7;uprising, energized;2;earthday, climatedebate, renewablenola, liveablefuture, reusable, fundourfuture, weatherize, sustainabil, climatejusticeismigrantjustice, tngreennewdeal, wasteland, sustainabilit, dadsforagreennewdeal, groundwater, cleanenergynow, climatec;16;0;0;uninsured, underinsured;2;thefutureisour, beat_trump;2;bailout, evict, collegeforall;3;awful, explode, unsatisfactory;3
week_8;youthactivism;1;stopthemoneypipeline, keepitintheground, pesticide, transitequityday, contaminate, radioactivity, radioactive, pollination, climateleader, oxygen, wastewater, enviromental, youthlobbyday, stormwater, sunrisemvmtclt, climateac, gndlaunchparty;17;whichsideareyouon;1;public_health;1;0;0;social_security, housingchoice;2;bespoke, incapable, slaughter;3
week_9;fundrais, activitist;2;rebellion, petroleum, conservation, renewables, fundclimatejustice, frontlineyouth, greenne, sunriselaunchparty, overpopulation, anthropogenic, priceoncarbon, sunriseversary, climemechange, humansofclimateaction, greennewdealp, climatetwitter, sunrisemvmtsalinas, climatebrawl, solarfreedom, solarenergy, climatechangeshealth, cliamtejustice, greennewdeallaunch, climatefundingnow, climatepolicy;25;coronavirus, virus, outbreak, corona;4;abortion, cancelstudentdebt;2;changer, facilitation;2;povertydebate, underpriveleged;2;despicable;1
week_10;0;0;wet'suwet'en, stoptmx, greennewd, generationgreennewdeal, environmentalism, climmaattteee, chaaangggeee, waterislife;8;0;0;0;0;0;0;student_debt;1;0;0
week_11;subsidize, unwavering;2;fossilfueldivestmentday, deepwater, voteoutmitch, permafrost, nofossilfuelmoneypledge, generationgnd, fracked, nonbkpipeline, evfreedomact, geothermal, powered, mayoralclimateforum, cleanfutureact, youthforclimate, poisoninthergv, sunrisemvmtdc, climateemergencynow, globaldivestmentday, clearthesmoke, notestonearthday;20;rona;1;medicaid, medicare;2;0;0;0;0;0;0
week_12;0;0;multigenerational, flintwatercrisis, greenpeace, climatesilence, greeen, herbicide, shoreline, theyoungpeoplewillwin, heartbreaking, sunrisespringbreak, greenwasher, contaminat, stopthefracking, savethergvfromlng, defendthesacre, dryland, generationaltraitor, climatecollapse, vegetarian, greenbond, climatech;21;0;0;reproductive, pharmaceutical;2;uncompromising;1;childcare, cancelstudentdeb;2;destructive, horribl;2
week_13;youthmovement, combatir;2;earthweeknyc, fossilfuel, pvd, recycling, planting, climatehoax, earthdaystrike, sunrisepaloalto, chlorpyrifos, ecologicalemergency, envirojusticenow, internationalpolarbearday, trilliontreesact, trillionstumpsact, keepitintheforest, keepitinthefor, netzeroisnotenough, landprotector, waterprotector, pipelineprotestor, texasforthegreennewdeal, voteenvironment, environmentalvoter, sunriseartbuild, pdxcleanenergy, combustible;26;pandemic, inflammatory;2;0;0;0;0;welfare;1;emerge, mortality;2
week_14;gofundme, organizevotestrike, actio;3;climatecandidate, sunrisecleveland, climateeme, climatee, sunrisemvmtsilverspring, yearstosavetheplanet, climateresistance, thetimeisnow, futuregrandparentsforbernie, texasforagreennewdeal;10;covid;1;healthcareforall;1;0;0;eviction, jobsguarantee, endhomelessness, universalchildcare;4;0;0
week_15;0;0;climatestrikeonline, houstonclimatestrike, bigyouthenergy, votegnd, drinkable, intergenerational, underinsure, portlandclimatedebate, greenwashing, phaseoutfossi, decarboniz, sunrisemvmthtx, greennewdealvoter, housingjusticeisclimatejustice, pdxclimatedebate, litterdoesntstopwhereitdrop, putitinyourpocket, rethinkrecyclemd, renewableene;19;quarantine, social_distancing, curve, distance, infect, sanitizer, immunocompromise, quarantining, coronaviruspandemic, exponential, coronapocalypse, coronavirusupdate, coronaviru;13;insura, diabetes, insured, underinsu;4;0;0;stimulus, emergencyubi, evictionmoratorium, coronaubi;4;0;0
week_16;grassro, signalbooste, takeaction;3;sunrisemvmtboise, morehealthybuilding, pollutersoutnow, newgreendeal, abolishfossilfuelbillionaire, tellsmudcleanpower, ctcleanclimate, thereisnoplanetb, fossilfuelindustry, hydrocarbon;10;essential_worker, lockdown, distancing, socialdistance, quarantinelife, bailoutthepeople, infectious, epidemiologist, disinfectant, coronavirusoutbreak, staythefhome, trumpvirus, flattenthecurve, immunosuppresse, stayathomechallenge, quaratinelife, stopthespread, coronapocolypse, dontbeaspreader, coronacrisis, corniavirus, coronav, coronavir;23;pharmacy, smallpox, telemedicine;3;0;0;unemployed, stimuluspackage, peoplefirst;3;unsafe, unaddressed, disillusionment;3
week_17;0;0;earthdaylive, sunrise_school, peoplenotpolluter, sunriseschool, greenstimulus, demandafuture, fridayforfuture, talksforfuture, environmenta, gengreennewdeal, energyjusticeri, sunriseneu, earthhour, keepwateron, bailouttheplanet, decarbonized, thearthday, greenstimu;18;influenza, healthyla, pandemi, stayhome, nooneisdisposable, hospitalization, stayathomeorder, stayhomesavelive, emergencyjustice, healthjustice, hydroxychloroquine, azithromycin, flattenthecuve;13;0;0;0;0;peoplesbailout, cancelrent, need_peoplesbailout, stimulusbill, stimulusplan, bailoutpeoplenotcorporation, breadline, housedandhealthy, bailoutthepeoplenotcorporation, forgivenessnotforbearance;10;failedsystem, maddening;2
week_18;virtual_rally;1;navajo, greennewdealcrash, goodgreenjobsforall, digitalclimatestrike, cleancarrule, greenjobsnocut, environmentalracism, hydro, biomass, geotherm;10;essentialwork, sanitation, stayathome, whencoronavirusisover, covidfrontline, protectnurse, socialdistancing, distanceing, stayhomestaysafe, highriskcovid, stayathomenotinjail, coronaviruse, pandemicprofiteere, transmit, asymptomatically, universalmaske, healthcareheroe, coronavirusup;18;nomedicaidcut, nomedicaidcuts, publichealthispublicsafety;3;0;0;cancel_rent, protectmotenant, rentfreeze, housepeoplenow;4;0;0
week_19;wewillrise, democratize;2;standwithmashpee, climatestillacrisis, walkbackthefrack, cantcancelclimatechange, nodrillingwherewerelive, shutdownwyatt, umbclimatestory, greenjobsnocu, climateactivist, cantcancelclimatechang, earthdayquote, offfossilfuel;12;pandemicin, rebuildstronger, ppenow, protectallworkers, wisconsinpandemicvoting, thankshealthheroe, covi;7;worldhealthday;1;forourfuture;1;evictio, raisethewagevirtualmarch, rentfreezenow, studentloanforgiveness, tuitionfreehighere, affordablehousingforall, debtstrike;7;0;0
week_20;0;0;earthweek, earthdayliveboston, greenjobs, nodrillingwherewereliving, ecosocialism, taxpolluter, megadrought;7;chicoisolatedtogether, stimulusdeposit, caresact;3;unitedhealth, radiologist, anesthesiologist, unitedhealthgroup, pediatrician, unitedhealthcare;6;0;0;underpaid, stimuluspayment, livingwage, peoplebailout, cancelrentusa, fairfundnow, bailouthumansnow;7;0;0
week_21;activistas;1;happy_earthday, earthdaytownhall, investinthefuture, defundclimatechange, thisiswhyicall, earthweekla, environmentalhealthcoalition, climateuprisingsd, virtualclimateuprise, climatechalkout, endorsethegnd, defundfossilfuel, endfossilfinance, bpdisaster, greenfaith, peopleoverpolluter, recyclable, virtualclimateuprising, planetofthehuman, dogsagainstclimatechange, stopfundingourdeath, pollut, iowavirtualearthday, sustainabili, sustaining, ourplanetourhome, renewableriker, happyearthday, paloaltosunrise, earthdayeveryday, earthweekn, greennewdealsd, climateemerge, investinourfuture, deepwaterhorizon, contaminated, cleanair, cleanwater, naturalgas, climatechalkoutchallenge, fossill, earthdaywatchparty, nofossil, earthdayweek, cheerstoagreennewdeal, virtualclimatestrike, planetearth, storyofplastic, fighteverycrisis, cleanenergy, energydemocracy, stopfinancingfossilfuel, fossilfuelfinancer, greenpeaceusa, fightingforafutureforourfurryfriend, fossilfreefuture, cleanupourair, justfresnothing, defundfossilfuels, calearthday, earthrise, voteearth, greenway, laearthweeklive;64;putpeoplefirst, peopleoverprofit, reopenamerica, asymptomatic, righttobreathe, righttolive, epidemiology, quarentine, wherearethetest, trumpcovidfail, covidenier;11;medic, insureourfuture, typhus;3;yearsofchange;1;rentstrikericci, servicesnotsweep, justbailout, standupkc, peoplesbailou, corporatebailout, rentsuspension, profitsoverpeople;8;epicenter, unethical;2
week_22;strikeforourlive;1;earthdaytomayday, carbonemission, holocene, climatestrikeonl, saynotofossilmoney, energyjustice;6;justrecovery, protectallworker, essentialandexclude, essentialnotexpendable, essentialworke, essentialworkersday, ppeoverprofit, coronastrike, trumpownseverydeath;9;expandmedicaidtn;1;0;0;norent, foodnotrent, homelesscantstayhome, noeviction, cancelmortgage, supportlocalgem, cantpaymay, nyhomesguarantee, reclaimrentcontrol, protectamazonworker, housingrelief, maydaystrike, goodjobsforall, realreliefnow, wholefoodsstrike;15;0;0
week_23;0;0;climatestrikecr, sunrisesd, climatechanged, peoplesnotpolluter, ecofacism, stopmoneypipeline, rewindact;7;quarantime, capitalismisthepandemic;2;medication, nationalnursesday;2;0;0;housingforall, therewindact, unsheltered, evictionmoritori, raisethewagepa;5;unliveable;1
week_24;0;0;sunrisebannerdropchallenge, greenjobsrecovery, zerowaste, aquaculture, onlineclimatestrike, tidalenergy, energyforall;7;heroesact;1;0;0;0;0;canceltherent;1;0;0
week_25;anotheroregonispossible, changethenarrative;2;buildavillagesavetheearth, climatejusticerecovery, savergvfromlng, noeastiesubstation, protectgarciapasture, powerhouse, bankingonclimate, pollutio;8;trumpdeathtoll, recoveryforall, putpeopleoverprofit, protectessentialworkers, quarantinelifecalm, blacknewdeal;6;0;0;0;0;peoplesbudge, thepeoplesbudgetla;2;monstrosity;1
week_26;0;0;sunrisewwu;1;decarceratecovid, peoplescovidrespon;2;0;0;0;0;0;0;0;0
